data_domain,current_handling,preferred_source,acquisition_method,model_use,priority
完整OD矩阵,多层网络最短路闭包近似，已生成40x40景点OD。,高德开放平台 Direction/Distance Matrix API,补齐景点经纬度后按景点对批量请求，区分普通日、暑期、五一、早晚高峰。,替换 enhanced_od_matrix 中的时间/距离/费用边权，作为PCOP、VRP、容量流的基础边权。,P0
铁路时刻/票价,核心城市对使用公开网页和情景等待时间近似。,中国铁路12306,人工或半自动抽取乌鲁木齐-吐鲁番/库尔勒/伊宁/喀什/和田等核心OD的车次、发车时间、历时、票价。,将铁路边升级为time-expanded arcs，表达发车时刻和错过班次的等待时间。,P0
航班时刻/票价,按主要机场间经验时长和票价建航空层。,航司官网、机场集团、航旅纵横、OTA抽样,采集乌鲁木齐-喀什/伊宁/阿克苏/库尔勒/和田/库车的日内班次、价格区间、提前到机场时间。,加入航班等待、安检提前量、延误风险、票价波动情景。,P1
景区日容量/瞬时容量,天池、赛里木湖、喀纳斯等有公开承载量，其余按等级模拟。,景区公告、文旅局公开信息、景区最大承载量公告,逐景区检索官方公告；无法查询时按5A/4A/普通景点分级设定并标注MODEL_ASSUMPTION。,作为第四问容量约束、拥挤惩罚和线路分配上界。,P0
开闭园/预约余量/闭馆日,用常见开放时间和人工解析规则生成time_windows。,景区公众号、一码游新疆、官方预约平台,按目标日期记录开放时间、停运项目、预约余量、是否闭馆或临时关闭。,加入 open_i <= arrival_i <= close_i 和日期可用性约束。,P0
酒店容量/价格,价格来自本地表，房量为住宿枢纽分级模拟。,携程/美团/同程抽样、统计年鉴住宿床位、酒店协会数据,按城市、日期、星级采样价格与可订房量，至少覆盖乌鲁木齐、吐鲁番、库尔勒、伊宁、喀什、和田。,住宿落点约束、满房风险、住宿价格上浮情景。,P1
道路封闭/天气风险,独库公路使用公开新闻，其余山地道路用情景风险模拟。,新疆交通运输厅、交警路况、气象局预警、景区封闭公告,按道路边维护季节开放窗口、封闭概率、恶劣天气延误倍数。,转化为边可用概率、风险分数和鲁棒优化场景。,P1
客流热度,使用五一宏观客流和少量景区承载量校准。,文旅厅节假日通报、景区公告、地图热力指数、运营商客流,按景区/城市/日期建立客流指数，无法获取时用搜索热度或点评数量做代理。,满意度、拥挤惩罚、候选线路投放规模和鲁棒场景概率。,P2
文化考察价值,按世界遗产、文保、宗教民族文化、博物馆等标签打分。,文旅部/文物局名录、世界遗产名录、非遗名录、地方政府介绍,为文化点建立多标签和权重，专家复核高价值点。,作为第三问主题覆盖、人文价值最大化和组内均衡约束。,P1
