gap_id,module,missing_or_weak_point,impact,next_action,priority
Q3-G1,主求解器,当前是启发式MinMax分组和组内贪心排序，不是精确MILP/CP-SAT,不能声称全局最优,建立14个文化点的三团队MinMax MILP或CP-SAT并输出gap,P0
Q3-G2,文化价值,文化价值权重来自规则评分，缺专家校准,文化点重要性排序可能被质疑,使用AHP/熵权法或专家打分校准文化价值权重,P0
Q3-G3,特殊准入,楼兰古城/尼雅遗址审批周期和成功率是模型假设,专项组可执行性需要更强证据,补官方审批流程/旅行社访谈/文旅部门说明并转为提前期和成功率参数,P0
Q3-G4,项目排程,没有逐日/小时级考察任务表,落地执行性不足,输出每组每日任务、住宿城市、交通、现场工作块和缓冲日,P1
Q3-G5,资源约束,未显式建模向导/越野车/安全员/考古专家等稀缺资源,无法表达多个组共享资源冲突,加入资源容量约束和技能匹配约束,P1
Q3-G6,鲁棒优化,缓冲策略是后验仿真，不是主模型中的鲁棒约束,模型与仿真仍是两阶段松耦合,加入chance constraint或CVaR目标：P(max_g T_g<=deadline)>=alpha,P1
Q3-G7,延期分布,天气/审批返工参数来自情景设定而非历史数据拟合,仿真可信度仍需说明假设,采集天气预警/封路/审批返工样本或访谈数据校准分布,P2
Q3-G8,成本口径,专项考察成本中向导、越野、安保、资料采集费用仍较粗,费用解释可能不完整,将专项服务成本拆成车辆、向导、许可、保险、住宿、备用金,P2

